{
    "$schema": "https://json-schema.org/draft/2020-12/schema",
    "type": "array",
    "items": {
        "type": "object",
        "required": ["bs_name", "bs_type", "bs_default", "bs_group", "bs_order", "bs_importance", "bs_description"],
        "additionalProperties": false,
        "properties": {
            "bs_name": {
                "type": "string",
                "title": "Setting Name",
                "pattern": "^[a-z][a-z0-9_]*$",
                "description": "Internal identifier for this setting, used as the key in the setup dict. Lowercase letters, digits, and underscores only. Example: 'escalate_policy', 'ad_account_id'."
            },
            "bs_type": {
                "type": "string",
                "title": "Input Type",
                "enum": ["string_short", "string_long", "string_multiline", "bool", "int", "float"],
                "description": "UI input control type. string_short: single-line text, string_long: wider single-line text, string_multiline: textarea, bool: toggle, int/float: numeric input."
            },
            "bs_default": {
                "title": "Default Value",
                "oneOf": [
                    { "type": "string" },
                    { "type": "boolean" },
                    { "type": "integer" },
                    {
                        "type": "number",
                        "not": { "multipleOf": 1 }
                    }
                ],
                "description": "Default value used when the admin has not provided an override in the setup dialog. Must match bs_type."
            },
            "bs_group": {
                "type": "string",
                "title": "Group",
                "description": "Tab or panel name in the setup dialog UI. Settings with the same bs_group appear together. Example: 'Policy', 'Email', 'Message Filtering'."
            },
            "bs_order": {
                "type": "integer",
                "title": "Order",
                "description": "Sort position within the group. Lower numbers appear first. Example: 1, 2, 3."
            },
            "bs_importance": {
                "type": "integer",
                "title": "Importance",
                "description": "Visibility priority in the setup dialog. 1 = highlighted as important for the admin to fill in, 0 = normal."
            },
            "bs_description": {
                "type": "string",
                "title": "Description",
                "description": "Help text shown to the admin in the setup dialog explaining what this setting controls."
            }
        }
    }
}
