[
    {
        "bs_name": "EMAIL_RESPOND_TO",
        "bs_type": "string_long",
        "bs_default": "",
        "bs_group": "Email",
        "bs_order": 1,
        "bs_importance": 0,
        "bs_description": "Email addresses the bot should respond to, comma-separated (e.g. sales@yourdomain.com). All other emails to your domains are logged as CRM activities only."
    },
    {
        "bs_name": "knowledge_eds_ids",
        "bs_type": "string_long",
        "bs_default": "",
        "bs_group": "Knowledge",
        "bs_order": 1,
        "bs_importance": 0,
        "bs_description": "Comma-separated list of External Data Source (EDS) IDs this bot should search. Leave empty to search all workspace EDS."
    }
]
