[
    {
        "bs_name": "greeting_style",
        "bs_type": "string_short",
        "bs_default": "cheerful",
        "bs_group": "Personality",
        "bs_order": 1,
        "bs_importance": 0,
        "bs_description": "How enthusiastic should the frog be? (cheerful, calm, excited)"
    },
    {
        "bs_name": "ribbit_frequency",
        "bs_type": "string_short",
        "bs_default": "normal",
        "bs_group": "Personality",
        "bs_order": 2,
        "bs_importance": 0,
        "bs_description": "How often should the frog ribbit? (rare, normal, frequent)"
    },
    {
        "bs_name": "tongue_capacity",
        "bs_type": "int",
        "bs_default": 5,
        "bs_group": "Hunting Abilities",
        "bs_order": 1,
        "bs_importance": 1,
        "bs_description": "Maximum number of insects this frog can catch in one hunting session. Like a real frog's stomach capacity!"
    }
]
